{
  "$schema": "https://yamada-ui.com/registry/v2/schema.json",
  "dependencies": {
    "components": [],
    "externals": ["react-focus-lock@^2.13.7"],
    "hooks": [],
    "providers": []
  },
  "dependents": {
    "components": ["drawer", "modal", "portal"],
    "hooks": [],
    "providers": []
  },
  "section": "components",
  "sources": [
    {
      "name": "focus-lock.test.browser.tsx",
      "content": "import { useRef, useState } from \"react\"\nimport { page, render, renderHook } from \"#test/browser\"\nimport { FocusLock } from \"./focus-lock\"\n\ndescribe(\"<FocusLock />\", () => {\n  test(\"correctly focuses on elements within the lock\", async () => {\n    await render(\n      <>\n        <button>Not Focused Button</button>\n        <FocusLock>\n          <button>Focused Button</button>\n        </FocusLock>\n      </>,\n    )\n\n    const notFocusedBtn = page.getByRole(\"button\", {\n      name: \"Not Focused Button\",\n      exact: true,\n    })\n    const focusedBtn = page.getByRole(\"button\", {\n      name: \"Focused Button\",\n      exact: true,\n    })\n\n    focusedBtn.element().focus()\n    await expect.element(focusedBtn).toHaveFocus()\n\n    notFocusedBtn.element().focus()\n    await expect.element(focusedBtn).toHaveFocus()\n  })\n\n  test(\"correctly focuses on the button with a reference when initialized\", async () => {\n    const { result } = await renderHook(() => useRef(null))\n\n    await render(\n      <FocusLock initialFocusRef={result.current}>\n        <button>Not Focused Button</button>\n        <button ref={result.current}>Focused Button</button>\n      </FocusLock>,\n    )\n\n    const focusedBtn = page.getByRole(\"button\", {\n      name: \"Focused Button\",\n      exact: true,\n    })\n    await expect.element(focusedBtn).toHaveFocus()\n  })\n\n  test(\"correctly focuses on contentRef when no focusable elements exist\", async () => {\n    const { result } = await renderHook(() => useRef(null))\n\n    await render(\n      <FocusLock contentRef={result.current}>\n        {/* eslint-disable-next-line jsx-a11y/no-noninteractive-tabindex */}\n        <div ref={result.current} tabIndex={0}>\n          No focusable elements here\n        </div>\n      </FocusLock>,\n    )\n\n    const contentDiv = page.getByText(\"No focusable elements here\")\n    await expect.element(contentDiv).toHaveFocus()\n  })\n\n  test(\"correctly focuses on the finalFocusRef when the FocusLock is unmounted\", async () => {\n    const TestComponent = () => {\n      const [isMounted, setIsMounted] = useState(true)\n      const outsideButtonRef = useRef<HTMLButtonElement>(null)\n\n      return (\n        <div>\n          <button ref={outsideButtonRef}>Outside Button</button>\n\n          {isMounted ? (\n            <FocusLock finalFocusRef={outsideButtonRef}>\n              <button>Focus Lock Button</button>\n            </FocusLock>\n          ) : null}\n\n          <button onClick={() => setIsMounted(false)}>\n            Unmount FocusLock Button\n          </button>\n        </div>\n      )\n    }\n\n    const { user } = await render(<TestComponent />)\n\n    const focusLockButton = page.getByRole(\"button\", {\n      name: \"Focus Lock Button\",\n    })\n    const outsideButton = page.getByRole(\"button\", { name: \"Outside Button\" })\n    const unmountButton = page.getByRole(\"button\", {\n      name: \"Unmount FocusLock Button\",\n    })\n\n    focusLockButton.element().focus()\n    await expect.element(focusLockButton).toHaveFocus()\n\n    await user.click(unmountButton)\n\n    await expect.element(outsideButton).toHaveFocus()\n  })\n})\n"
    },
    {
      "name": "focus-lock.tsx",
      "content": "\"use client\"\n\nimport type { FC, PropsWithChildren, RefObject } from \"react\"\nimport { useCallback, useState } from \"react\"\nimport ReactFocusLock from \"react-focus-lock\"\nimport {\n  createContext,\n  getFocusableElements,\n  interopDefault,\n} from \"@yamada-ui/react\"\n\nconst [FocusLockShardContext, useFocusLockShard] = createContext<\n  ((shard: HTMLElement) => () => void) | undefined\n>({ name: \"FocusLockShardContext\", strict: false })\n\nexport { useFocusLockShard }\n\nconst InternalFocusLock = interopDefault(ReactFocusLock)\n\nexport interface FocusLockProps extends PropsWithChildren {\n  /**\n   * If `true`, the first focusable element within the `children` will auto-focused once `FocusLock` mounts.\n   *\n   * @default false\n   */\n  autoFocus?: boolean\n  /**\n   * The `ref` of the wrapper for which the focus-lock wraps.\n   */\n  contentRef?: RefObject<HTMLElement | null>\n  /**\n   * If `true`, focus trapping will be disabled.\n   *\n   * @default false\n   */\n  disabled?: boolean\n  /**\n   * `ref` of the element to return focus to when `FocusLock` unmounts.\n   */\n  finalFocusRef?: RefObject<HTMLElement | null>\n  /**\n   * `ref` of the element to receive focus initially.\n   */\n  initialFocusRef?: RefObject<HTMLElement | null>\n  /**\n   * Enables aggressive focus capturing within iframes.\n   * - If `true`: keep focus in the lock, no matter where lock is active.\n   * - If `false`:  allows focus to move outside of iframe.\n   *\n   * @default false\n   */\n  lockFocusAcrossFrames?: boolean\n  /**\n   * If `true`, disables text selections inside, and outside focus lock.\n   *\n   * @default false\n   */\n  persistentFocus?: boolean\n  /**\n   * If `true`, focus will be restored to the element that triggered the `FocusLock` once it unmounts.\n   *\n   * @default false\n   */\n  restoreFocus?: boolean\n}\n\n/**\n * `FocusLock` is a component that improves accessibility by restricting focus within elements such as modals and dialogs, and locking the focus within that range.\n *\n * @see https://yamada-ui.com/docs/components/focus-lock\n */\nexport const FocusLock: FC<FocusLockProps> = ({\n  autoFocus,\n  children,\n  contentRef,\n  disabled,\n  finalFocusRef,\n  initialFocusRef,\n  lockFocusAcrossFrames,\n  persistentFocus,\n  restoreFocus,\n}) => {\n  const [shards, setShards] = useState<HTMLElement[]>([])\n  const returnFocus = restoreFocus && !finalFocusRef\n\n  const registerShard = useCallback((shard: HTMLElement) => {\n    setShards((prev) => (prev.includes(shard) ? prev : [...prev, shard]))\n\n    return () => {\n      setShards((prev) => prev.filter((item) => item !== shard))\n    }\n  }, [])\n\n  const onActivation = useCallback(() => {\n    if (initialFocusRef?.current) {\n      initialFocusRef.current.focus()\n    } else if (contentRef?.current) {\n      const focusables = getFocusableElements(contentRef.current)\n\n      if (focusables.length === 0)\n        requestAnimationFrame(() => {\n          contentRef.current?.focus()\n        })\n    }\n  }, [initialFocusRef, contentRef])\n\n  const onDeactivation = useCallback(() => {\n    finalFocusRef?.current?.focus()\n  }, [finalFocusRef])\n\n  return (\n    <FocusLockShardContext value={registerShard}>\n      <InternalFocusLock\n        autoFocus={autoFocus}\n        crossFrame={lockFocusAcrossFrames}\n        disabled={disabled}\n        persistentFocus={persistentFocus}\n        returnFocus={returnFocus}\n        shards={shards}\n        onActivation={onActivation}\n        onDeactivation={onDeactivation}\n      >\n        {children}\n      </InternalFocusLock>\n    </FocusLockShardContext>\n  )\n}\n"
    },
    {
      "name": "index.ts",
      "content": "export { FocusLock, useFocusLockShard } from \"./focus-lock\"\nexport type { FocusLockProps } from \"./focus-lock\"\n"
    }
  ]
}
