{
  "$schema": "https://yamada-ui.com/registry/v2/schema.json",
  "dependencies": {
    "components": [],
    "externals": [],
    "hooks": [],
    "providers": []
  },
  "dependents": {
    "components": ["number-input"],
    "hooks": [],
    "providers": []
  },
  "section": "hooks",
  "sources": [
    {
      "name": "index.ts",
      "content": "\"use client\"\n\nimport { useCallback, useState } from \"react\"\nimport {\n  clampNumber,\n  countDecimal,\n  toPrecision,\n  useCallbackRef,\n} from \"@yamada-ui/react\"\n\nconst parse = (value: number | string): number =>\n  parseFloat(value.toString().replace(/[^\\w.-]+/g, \"\"))\n\nconst getCountDecimal = (value: number, step: number): number =>\n  Math.max(countDecimal(step), countDecimal(value))\n\nconst casting = (\n  value: number | string,\n  step: number,\n  precision?: number,\n): string | undefined => {\n  value = parse(value)\n\n  return !Number.isNaN(value)\n    ? toPrecision(value, precision ?? getCountDecimal(value, step))\n    : undefined\n}\n\nexport interface UseCounterProps {\n  /**\n   * The initial value of the counter.\n   * Should be less than `max` and greater than `min`.\n   */\n  defaultValue?: number | string\n  /**\n   * This controls the value update behavior in general.\n   *\n   * - If `true` and you use the stepper or up/down arrow keys,\n   * the value will not exceed the `max` or go lower than `min`.\n   *\n   * - If `false`, the value will be allowed to go out of range.\n   *\n   * @default true\n   */\n  keepWithinRange?: boolean\n  /**\n   * The maximum value of the counter\n   *\n   * @default Number.MAX_SAFE_INTEGER\n   */\n  max?: number\n  /**\n   * The minimum value of the counter\n   *\n   * @default Number.MIN_SAFE_INTEGER\n   */\n  min?: number\n  /**\n   * The number of decimal points used to round the value.\n   */\n  precision?: number\n  /**\n   * The step used to increment or decrement the value.\n   *\n   * @default 1\n   */\n  step?: number\n  /**\n   * The value of the counter.\n   * Should be less than `max` and greater than `min`.\n   */\n  value?: number | string\n  /**\n   * The callback fired when the value changes.\n   */\n  onChange?: (valueAsString: string, valueAsNumber: number) => void\n}\n\n/**\n * `useCounter` is a custom hook that returns the current counter value.\n *\n * @see https://yamada-ui.com/docs/hooks/use-counter\n */\nexport const useCounter = ({\n  keepWithinRange = true,\n  max: maxValue = Number.MAX_SAFE_INTEGER,\n  min: minValue = Number.MIN_SAFE_INTEGER,\n  step: stepProp = 1,\n  ...props\n}: UseCounterProps = {}) => {\n  const onChange = useCallbackRef(props.onChange)\n\n  const [defaultValue, setValue] = useState<number | string>(() => {\n    if (props.defaultValue == null) return \"\"\n\n    return casting(props.defaultValue, stepProp, props.precision) ?? \"\"\n  })\n\n  const isControlled = typeof props.value !== \"undefined\"\n  const value = isControlled ? (props.value as number | string) : defaultValue\n\n  const countDecimal = getCountDecimal(parse(value), stepProp)\n\n  const precision = props.precision ?? countDecimal\n\n  const update = useCallback(\n    (next: number | string) => {\n      if (next === value) return\n\n      if (!isControlled) setValue(next.toString())\n\n      onChange(next.toString(), parse(next))\n    },\n    [onChange, isControlled, value],\n  )\n\n  const clamp = useCallback(\n    (value: number) => {\n      let nextValue = value\n\n      if (keepWithinRange)\n        nextValue = clampNumber(nextValue, minValue, maxValue)\n\n      return toPrecision(nextValue, precision)\n    },\n    [precision, keepWithinRange, maxValue, minValue],\n  )\n\n  const increment = useCallback(\n    (step = stepProp) => {\n      let next: number | string\n\n      if (value === \"\") next = parse(step)\n      else next = parse(value) + step\n\n      next = clamp(next)\n\n      update(next)\n    },\n    [clamp, stepProp, update, value],\n  )\n\n  const decrement = useCallback(\n    (step = stepProp) => {\n      let next: number | string\n\n      if (value === \"\") next = parse(-step)\n      else next = parse(value) - step\n\n      next = clamp(next)\n\n      update(next)\n    },\n    [clamp, stepProp, update, value],\n  )\n\n  const reset = useCallback(() => {\n    let next: number | string\n\n    if (props.defaultValue == null) next = \"\"\n    else\n      next = casting(props.defaultValue, stepProp, props.precision) ?? minValue\n\n    update(next)\n  }, [props.defaultValue, props.precision, stepProp, update, minValue])\n\n  const cast = useCallback(\n    (value: number | string) => {\n      const nextValue = casting(value, stepProp, precision) ?? minValue\n\n      update(nextValue)\n    },\n    [precision, stepProp, update, minValue],\n  )\n\n  const valueAsNumber = parse(value)\n\n  const out = valueAsNumber < minValue || maxValue < valueAsNumber\n  const max = valueAsNumber === maxValue\n  const min = valueAsNumber === minValue\n\n  return {\n    cast,\n    clamp,\n    decrement,\n    increment,\n    max,\n    min,\n    out,\n    precision,\n    reset,\n    setValue,\n    step: stepProp,\n    update,\n    value,\n    valueAsNumber,\n  }\n}\n\nexport type UseCounterReturn = ReturnType<typeof useCounter>\n"
    }
  ],
  "tag": "dev"
}
