{
  "$schema": "https://yamada-ui.com/registry/v2/schema.json",
  "dependencies": {
    "components": [],
    "externals": [],
    "hooks": ["use-event-listener"],
    "providers": []
  },
  "dependents": {
    "components": ["editable", "popover"],
    "hooks": [],
    "providers": []
  },
  "section": "hooks",
  "sources": [
    {
      "name": "index.ts",
      "content": "\"use client\"\n\nimport type { RefObject } from \"react\"\nimport { useCallback, useEffect, useRef } from \"react\"\nimport {\n  contains,\n  getActiveElement,\n  getDocument,\n  getFirstFocusableElement,\n  isRefObject,\n  isSafari,\n  isShadowRoot,\n  useUpdateEffect,\n} from \"@yamada-ui/react\"\nimport { useEventListener } from \"../use-event-listener\"\n\nexport interface UseFocusOnShowProps {\n  focusTarget?: HTMLElement | null | RefObject<HTMLElement | null>\n  preventScroll?: boolean\n  shouldFocus?: boolean\n  visible?: boolean\n}\n\n/**\n * `useFocusOnShow` is a custom hook that focuses on the target element when it is shown.\n *\n * @see https://yamada-ui.com/docs/hooks/use-focus-on-show\n */\nexport const useFocusOnShow = <Y extends HTMLElement>(\n  refOrEl: RefObject<null | Y> | Y,\n  {\n    focusTarget: focusRefOrEl,\n    preventScroll,\n    shouldFocus,\n    visible,\n  }: UseFocusOnShowProps = {\n    preventScroll: true,\n    shouldFocus: false,\n  },\n) => {\n  const trulyShouldFocus = shouldFocus && visible\n  const focused = useRef(false)\n  const focusFrame = useRef(0)\n\n  const getTarget = useCallback(() => {\n    return isRefObject(refOrEl) ? refOrEl.current : refOrEl\n  }, [refOrEl])\n\n  const getFocusTarget = useCallback(() => {\n    return isRefObject(focusRefOrEl) ? focusRefOrEl.current : focusRefOrEl\n  }, [focusRefOrEl])\n\n  const onFocus = useCallback(() => {\n    const target = getTarget()\n\n    if (!target || !trulyShouldFocus || focused.current) return\n    const rootNode = target.getRootNode()\n    const root = isShadowRoot(rootNode) ? rootNode : getDocument(target)\n    if (contains(target, getActiveElement(root))) return\n\n    const focusTarget =\n      getFocusTarget() ?? getFirstFocusableElement(target) ?? target\n\n    cancelAnimationFrame(focusFrame.current)\n    focusFrame.current = requestAnimationFrame(() => {\n      focusTarget.focus({ preventScroll })\n\n      focused.current = true\n    })\n  }, [getTarget, trulyShouldFocus, getFocusTarget, preventScroll])\n\n  useUpdateEffect(() => {\n    focused.current = !trulyShouldFocus\n  }, [trulyShouldFocus])\n\n  useUpdateEffect(() => {\n    const frame = requestAnimationFrame(onFocus)\n\n    return () => cancelAnimationFrame(frame)\n  }, [onFocus])\n\n  useEffect(() => () => cancelAnimationFrame(focusFrame.current), [onFocus])\n\n  useEventListener(getTarget, \"transitionend\", onFocus)\n}\n\nexport interface UseFocusOnMouseDownProps {\n  ref: RefObject<HTMLElement | null>\n  elements?: (HTMLElement | null | RefObject<HTMLElement | null>)[]\n  enabled?: boolean\n}\n\n/**\n * `useFocusOnPointerDown` is a custom hook that focuses on the target element when it is clicked.\n *\n * @see https://yamada-ui.com/docs/hooks/use-focus-on-pointer-down\n */\nexport const useFocusOnPointerDown = ({\n  ref,\n  elements,\n  enabled,\n}: UseFocusOnMouseDownProps) => {\n  useEventListener(\n    () => ref.current?.getRootNode() ?? getDocument(ref.current),\n    \"pointerdown\",\n    (ev) => {\n      if (!isSafari() || !enabled) return\n\n      const target = ev.target as HTMLElement\n      const els = elements ?? [ref]\n      const rootNode = ref.current?.getRootNode()\n      const root = isShadowRoot(rootNode) ? rootNode : getDocument(ref.current)\n      const validTarget = els.some((elOrRef) => {\n        const el = isRefObject(elOrRef) ? elOrRef.current : elOrRef\n\n        return el?.contains(target) || el === target\n      })\n\n      if (getActiveElement(root) !== target && validTarget) {\n        ev.preventDefault()\n\n        target.focus()\n      }\n    },\n  )\n}\n"
    }
  ],
  "tag": "dev"
}
