{
  "$schema": "https://yamada-ui.com/registry/v2/schema.json",
  "dependencies": {
    "components": ["show"],
    "externals": [],
    "hooks": ["use-mounted"],
    "providers": []
  },
  "section": "components",
  "sources": [
    {
      "name": "client-only.tsx",
      "content": "\"use client\"\n\nimport type { FC, ReactNode } from \"react\"\nimport type { ReactNodeOrFunction } from \"@yamada-ui/react\"\nimport { useMounted } from \"../../hooks/use-mounted\"\nimport { Show } from \"../show\"\n\nexport interface ClientOnlyProps {\n  /**\n   * The content to render on the client side.\n   *\n   * **Note:** Use the function pattern when accessing browser-only APIs.\n   */\n  children: ReactNodeOrFunction\n  /**\n   * The fallback content to render while the component is mounting on the client\n   * side.\n   */\n  fallback?: ReactNode\n}\n\n/**\n * `ClientOnly` is a component that renders its children only on the client side.\n *\n * @see https://yamada-ui.com/docs/components/client-only\n */\nexport const ClientOnly: FC<ClientOnlyProps> = ({ children, fallback }) => {\n  const mounted = useMounted({ state: true })\n\n  return (\n    <Show fallback={fallback} when={mounted}>\n      {children}\n    </Show>\n  )\n}\n"
    },
    {
      "name": "index.ts",
      "content": "export { ClientOnly } from \"./client-only\"\nexport type { ClientOnlyProps } from \"./client-only\"\n"
    }
  ],
  "tag": "next"
}
