{
  "$schema": "https://yamada-ui.com/registry/v2/schema.json",
  "dependencies": {
    "components": [],
    "externals": [],
    "hooks": [],
    "providers": []
  },
  "dependents": {
    "components": ["float", "stack"],
    "hooks": [],
    "providers": []
  },
  "section": "components",
  "sources": [
    {
      "name": "box.tsx",
      "content": "\"use client\"\n\nimport type { HTMLStyledProps } from \"@yamada-ui/react\"\nimport { styled } from \"@yamada-ui/react\"\n\nexport interface BoxProps extends HTMLStyledProps {}\n\n/**\n * `Box` is the most abstract component on which all other components are built. By default, it renders a `div` element.\n *\n * @see https://yamada-ui.com/docs/components/box\n */\nexport const Box = styled(\"div\")\n"
    },
    {
      "name": "index.ts",
      "content": "export { Box } from \"./box\"\nexport type { BoxProps } from \"./box\"\n"
    }
  ],
  "tag": "dev"
}
